{
  "signal_id": "perf_symbology_board_001",
  "project_id": "proj_door_left_lit",
  "output_record_id": "out_door_left_lit_branch_station_001",
  "captured_at": "2026-06-20T12:10:00Z",
  "source": "manual_import",
  "metric_name": "save_rate",
  "metric_value": 0.32,
  "signal_direction": "positive",
  "evidence_weight": "equal_to_artist_feedback",
  "notes": "Example metric only; performance signals are evidence, not automatic overrides."
}
